{
  "$schema": "./UNI_PROVENANCE_AUDIT_G6_SCHEMA.json",
  "schema_version": "G6-provenance-audit",
  "audit_id": "G6-B-provenance",
  "metadata_only": true,
  "observed_at": "2026-10-18",
  "scope": {
    "manifest_count": 4,
    "input_manifests": [
      "docs/coordination/UNI_CORPUS_LOTTO_G1.json",
      "Fondamenti_Pack/PROVENANCE_MANIFEST_G2.json",
      "UNIVERSITA_EDILIZIA/ENERGETICA_INCENTIVI_PACK/fonti/PROVENANCE_MANIFEST_G3_GSE_CT3.json",
      "docs/coordination/UNI_CORPUS_LOTTO_G5_ECFR.json"
    ],
    "excluded_payloads": [
      "PDF bytes/content",
      "XML bytes/content",
      "course cards and values",
      "exam questions, answers, and solutions"
    ],
    "state_policy": "No state is promoted. verified is emitted only when explicitly present in an input manifest; observed_local remains observed_local."
  },
  "summary": {
    "record_count": 33,
    "by_proof_state": {
      "verified": 0,
      "observed_local": 29,
      "context_only": 2,
      "blocked": 2
    },
    "by_url_status": {
      "declared": 31,
      "not_declared": 2
    },
    "by_license_status": {
      "declared": 29,
      "not_declared": 4
    },
    "residual_code_counts": {
      "blocked_until_missing_metadata_or_evidence_is_supplied": 2,
      "content_or_legal_accuracy_not_checked": 1,
      "context_does_not_prove_source_vigency_or_reuse": 2,
      "current_version_or_vigency_not_checked": 1,
      "exact_url_not_declared": 2,
      "external_url_availability_not_checked": 29,
      "independent_license_clearance_not_checked": 29,
      "license_or_reuse_terms_not_declared": 4,
      "manifest_id_not_declared_lot_id_used_as_reference": 14,
      "manifest_metadata_only_flag_not_declared": 14
    }
  },
  "manifests": [
    {
      "path": "docs/coordination/UNI_CORPUS_LOTTO_G1.json",
      "manifest_id": "G1-FONDAMENTI-GUTENBERG-RAW",
      "manifest_id_source": "lot_id_fallback",
      "schema_version": "G1",
      "metadata_only": null,
      "metadata_only_flag": "not_declared",
      "collection_counts": {
        "records": 14
      }
    },
    {
      "path": "Fondamenti_Pack/PROVENANCE_MANIFEST_G2.json",
      "manifest_id": "G2-FONDAMENTI-PACK-G1-PROVENANCE",
      "manifest_id_source": "manifest_id",
      "schema_version": "G2-package-metadata",
      "metadata_only": true,
      "metadata_only_flag": "declared_true",
      "collection_counts": {
        "records": 14
      }
    },
    {
      "path": "UNIVERSITA_EDILIZIA/ENERGETICA_INCENTIVI_PACK/fonti/PROVENANCE_MANIFEST_G3_GSE_CT3.json",
      "manifest_id": "G3-2-ENERGETICA-GSE-CT3",
      "manifest_id_source": "manifest_id",
      "schema_version": "G3-source-metadata",
      "metadata_only": true,
      "metadata_only_flag": "declared_true",
      "collection_counts": {
        "records": 2
      }
    },
    {
      "path": "docs/coordination/UNI_CORPUS_LOTTO_G5_ECFR.json",
      "manifest_id": "G5-ECFR-OSHA-1926",
      "manifest_id_source": "manifest_id",
      "schema_version": "G5-source-metadata",
      "metadata_only": true,
      "metadata_only_flag": "declared_true",
      "collection_counts": {
        "source_records": 1,
        "official_context_records": 1,
        "related_blockers": 1
      }
    }
  ],
  "records": [
    {
      "record_key": "Fondamenti_Pack/PROVENANCE_MANIFEST_G2.json#G1-001",
      "manifest_path": "Fondamenti_Pack/PROVENANCE_MANIFEST_G2.json",
      "manifest_id": "G2-FONDAMENTI-PACK-G1-PROVENANCE",
      "record_id": "G1-001",
      "record_kind": "source",
      "title": "The Nicomachean Ethics",
      "entity": null,
      "source_kind": "public_domain_work",
      "local_path": "Fondamenti_Pack/raw/gutenberg/Aristotle_Ethics_pg8438.txt",
      "url": {
        "status": "declared",
        "value": "https://www.gutenberg.org/ebooks/8438",
        "basis": "locator.url"
      },
      "license": {
        "status": "declared",
        "label": "Public domain",
        "basis_path": "Fondamenti_Pack/licenze_audit.json",
        "basis_selector": "fonti[id=GUTENBERG-CLASSICI]"
      },
      "proof_state": "observed_local",
      "hash": {
        "algorithm": "SHA-256",
        "value": "A68264A6537BB58B899ED68E25D1C7D8EA1BCB3E9544B4D1B464F74D99C3D059"
      },
      "residual_codes": [
        "external_url_availability_not_checked",
        "independent_license_clearance_not_checked"
      ],
      "residuals": [
        "not_checked:external_url_availability",
        "not_checked:current_license_terms",
        "not_checked:independent_legal_public_domain_status",
        "limitation:La licenza è riportata come dichiarazione osservata nei file locali e non come parere giuridico indipendente.",
        "limitation:Il record non contiene il testo della fonte né una validazione di accuratezza o completezza.",
        "limitation:L'anno è il metadato locale della pubblicazione/opera, non una revisione del file raw."
      ]
    },
    {
      "record_key": "Fondamenti_Pack/PROVENANCE_MANIFEST_G2.json#G1-002",
      "manifest_path": "Fondamenti_Pack/PROVENANCE_MANIFEST_G2.json",
      "manifest_id": "G2-FONDAMENTI-PACK-G1-PROVENANCE",
      "record_id": "G1-002",
      "record_kind": "source",
      "title": "Calculus Made Easy",
      "entity": null,
      "source_kind": "public_domain_work",
      "local_path": "Fondamenti_Pack/raw/gutenberg/Calculus_Made_Easy_Thompson.txt",
      "url": {
        "status": "declared",
        "value": "https://archive.org/details/in.ernet.dli.2015.94125",
        "basis": "locator.url"
      },
      "license": {
        "status": "declared",
        "label": "Public domain",
        "basis_path": "Fondamenti_Pack/licenze_audit.json",
        "basis_selector": "fonti[id=GUTENBERG-CLASSICI]"
      },
      "proof_state": "observed_local",
      "hash": {
        "algorithm": "SHA-256",
        "value": "C24B6E367D112398B488AAF61BE728EC125E3B251212BA98CEFFB73FD9ADBF0F"
      },
      "residual_codes": [
        "external_url_availability_not_checked",
        "independent_license_clearance_not_checked"
      ],
      "residuals": [
        "not_checked:external_url_availability",
        "not_checked:current_license_terms",
        "not_checked:independent_legal_public_domain_status",
        "limitation:La licenza è riportata come dichiarazione osservata nei file locali e non come parere giuridico indipendente.",
        "limitation:Il record non contiene il testo della fonte né una validazione di accuratezza o completezza.",
        "limitation:L'anno è il metadato locale della pubblicazione/opera, non una revisione del file raw."
      ]
    },
    {
      "record_key": "Fondamenti_Pack/PROVENANCE_MANIFEST_G2.json#G1-003",
      "manifest_path": "Fondamenti_Pack/PROVENANCE_MANIFEST_G2.json",
      "manifest_id": "G2-FONDAMENTI-PACK-G1-PROVENANCE",
      "record_id": "G1-003",
      "record_kind": "source",
      "title": "Discourse on the Method",
      "entity": null,
      "source_kind": "public_domain_work",
      "local_path": "Fondamenti_Pack/raw/gutenberg/Descartes_Discourse_pg59.txt",
      "url": {
        "status": "declared",
        "value": "https://www.gutenberg.org/ebooks/59",
        "basis": "locator.url"
      },
      "license": {
        "status": "declared",
        "label": "Public domain",
        "basis_path": "Fondamenti_Pack/licenze_audit.json",
        "basis_selector": "fonti[id=GUTENBERG-CLASSICI]"
      },
      "proof_state": "observed_local",
      "hash": {
        "algorithm": "SHA-256",
        "value": "7768BA8D3895BE3D6F1492733FFAB983D69875CC743EDD23A1840E1530D02924"
      },
      "residual_codes": [
        "external_url_availability_not_checked",
        "independent_license_clearance_not_checked"
      ],
      "residuals": [
        "not_checked:external_url_availability",
        "not_checked:current_license_terms",
        "not_checked:independent_legal_public_domain_status",
        "limitation:La licenza è riportata come dichiarazione osservata nei file locali e non come parere giuridico indipendente.",
        "limitation:Il record non contiene il testo della fonte né una validazione di accuratezza o completezza.",
        "limitation:L'anno è il metadato locale della pubblicazione/opera, non una revisione del file raw."
      ]
    },
    {
      "record_key": "Fondamenti_Pack/PROVENANCE_MANIFEST_G2.json#G1-004",
      "manifest_path": "Fondamenti_Pack/PROVENANCE_MANIFEST_G2.json",
      "manifest_id": "G2-FONDAMENTI-PACK-G1-PROVENANCE",
      "record_id": "G1-004",
      "record_kind": "source",
      "title": "Relativity: The Special and General Theory",
      "entity": null,
      "source_kind": "public_domain_work",
      "local_path": "Fondamenti_Pack/raw/gutenberg/Einstein_Relativity_pg30155.txt",
      "url": {
        "status": "declared",
        "value": "https://www.gutenberg.org/ebooks/30155",
        "basis": "locator.url"
      },
      "license": {
        "status": "declared",
        "label": "Public domain",
        "basis_path": "Fondamenti_Pack/licenze_audit.json",
        "basis_selector": "fonti[id=GUTENBERG-CLASSICI]"
      },
      "proof_state": "observed_local",
      "hash": {
        "algorithm": "SHA-256",
        "value": "86ED8156239455CBB6ED33E06097707D3AB7C40D46E9AA5FF32D3C3F94EF68FD"
      },
      "residual_codes": [
        "external_url_availability_not_checked",
        "independent_license_clearance_not_checked"
      ],
      "residuals": [
        "not_checked:external_url_availability",
        "not_checked:current_license_terms",
        "not_checked:independent_legal_public_domain_status",
        "limitation:La licenza è riportata come dichiarazione osservata nei file locali e non come parere giuridico indipendente.",
        "limitation:Il record non contiene il testo della fonte né una validazione di accuratezza o completezza.",
        "limitation:L'anno è il metadato locale della pubblicazione/opera, non una revisione del file raw."
      ]
    },
    {